Username,Comment Time,Comment Text,Thumbnail URL,Number of Likes
Adnan Shoukat,1 year ago,Bro can you bring more people like this to your podcast.,https://yt3.ggpht.com/ytc/AGIKgqMof8k2_BRWtd2yUMsQyPiwFfV4u8nl5kqGdZmk6A=s48-c-k-c0x00ffffff-no-rj,3
Muhammad Saad Qasim,1 year ago,"Hello Sir, Can you make a video about the difference between Software Engineering and BSCS in complete Details. It would be really helpful if you can, In 15 days going to University for software engineering ,still have confusion between software engineering and BSCS. Help via Reply would be appreciated. Thanks!.",https://yt3.ggpht.com/ytc/AGIKgqO0a1TIeXjcDHk67cz6EufoPNbDlwP8jrrvdj6dBA=s48-c-k-c0x00ffffff-no-rj,3
Ibrahim Abid,1 year ago,Ehmad Bhai please also interview someone who belongs to the AI department (Artificial Intelligence).,https://yt3.ggpht.com/ytc/AGIKgqOPGeWFF4A3JqxGJuiXBc3XNo3c8qfbhzqwR53GlA=s48-c-k-c0x00ffffff-no-rj,1
Glomestone,1 year ago,Great video Ehmad! Loved the little bit of sense of humor in the middle. Keep up the good work!,,3
Hamza khan,1 year ago,"Very informative, please make video on how to improve communication skill and best way to sell yourself in an interview",,3
For You #shorts,5 months ago,"Thank you, sir, I am planning to go to Germany & this was really helpful information for me.",,0
Farhan Khan,1 year ago,Amazing Masha Allah keep up the good work️,,1
Salman Ahmed Khan,1 year ago,Very much informative video and great channel. Love you bro ,,2
Mubeen Channa,1 year ago,"Awesome Video ️
Make more videos like this",,0
Ayesha Fatima,1 year ago,Great content. Can u make a video on multinational companies currently working in Pakistan. I'm from Kashmir & I searched about it  but couldn't get information & don't have enough knowledge and access to multinational companies,,3
CR Bxwed,1 year ago,Sir can you make a video on what books you should self study and which online courses you should take while studying your normal university curriculum for SE/CS in university?,,7
Ali Jamshed,1 year ago,"Only 827 views so far, this should have been viewed 827K times. Great Content.",,3
Mian Khalid,1 year ago (edited),"""Bohat maza aaye ga apko"" - Usman Abbasi
Quote of the day hogya ... Or maza aa gaya  
Timestamp = 29:15 (thank me later)",,2
Zohaib Zahid Malik,1 year ago,Very informative video !,https://yt3.ggpht.com/ytc/AGIKgqOTqgSGNWoVViur0pOwNnvv-M2S0lXuRY19Cbbm=s48-c-k-c0x00ffffff-no-rj,2
Muhammad Usman Akram,10 months ago,Which tech stack should we learn??,https://yt3.ggpht.com/ytc/AGIKgqOK4cZ1N8eWx6Jo3VRlHEgSEbGYzph_BlHIIQ=s48-c-k-c0x00ffffff-no-rj,0
Mohammad Talha,1 year ago,"Came to your channel after watching your podcast on Muzammil's channel, deffo doing good work!!",https://yt3.ggpht.com/ytc/AGIKgqMFTDo6RMT6J4AG6Uoko1PO_xemJtvP3H6dNCxfqw=s48-c-k-c0x00ffffff-no-rj,2
Muhammad Husnain,6 months ago,loving your podcasts bro!,https://yt3.ggpht.com/ytc/AGIKgqNfIUMbi9IA3f8YbUy6h-P2v5X4zzlVDc2v1w=s48-c-k-c0x00ffffff-no-rj,0
Ameer Hamza,1 year ago,"Great bro is university matter like in paksitan there are many developer who are not from reputed university like fast and nust ""these university matter for getting job in foreign country like USA German""",https://yt3.ggpht.com/_Lxg78RzsCago7wc3XBNxlkIj8FScb8MNNo8o1XdwaNeF6AwMAjC8plXQBBS44kyGxaEiB989w=s48-c-k-c0x00ffffff-no-rj,10
Muhammad Safi Ullah,7 months ago,Very informative!,https://yt3.ggpht.com/ytc/AGIKgqP-wbLWI-6_Nt2ewTdZ4S-TgOpyJ20bxshlkB6SJA=s48-c-k-c0x00ffffff-no-rj,0
A I.,1 year ago,Emad is if possible to get a video on how to create a resume for internship?,https://yt3.ggpht.com/HRwx2HMgrydzIoJKWUU4fAf69WXq51t9ca059rXvSjGT5KteMCPYFlenvbRMu75RDONtiNBV0Q=s48-c-k-c0x00ffffff-no-rj,1
Comment-Bot,1 year ago,"This is very informative.
I have a question sir,
I am 40, working as a transcriptionist in KSA.
I want to learn programming language and move from here. Kindly guide me a path, or a string to follow helping me in switching my career at this age. Which language i should start learning that can help me achieve my objective in a year's time?
Thank you.",https://yt3.ggpht.com/ytc/AGIKgqN7ARQfxMaWnuXFWTd_66ZF-GYQAR7V77l4HQKnwQ=s48-c-k-c0x00ffffff-no-rj,2
Kashan Ali,1 year ago,"I am 1st year student of software engineering 
Please prefer me courses according to my field and year.
Thanks in advance ️",https://yt3.ggpht.com/ECzTXQo1700UQ6slyIId6M62V1A-pz-lyvm5dtuN9R3CcGVq1FZMIdXF0VhBKeTtdViIJqz1=s48-c-k-c0x00ffffff-no-rj,2
Mohd Kashif Salmani,1 year ago,Good One Brother ,https://yt3.ggpht.com/nsP6JX220YaIkdeUU1GmSe-gSMbc_bijCEOqEoQC31ug_DGiAO9xgHQerJxnqhJ6MsEwr1BT=s48-c-k-c0x00ffffff-no-rj,2
Ramsha Aijaz,1 year ago,Great conversation,,2
Hikmat Ullah,1 year ago,"Good work 
Sir I am new to computer and 8 want to be a software engineer what should I do or learn first",,1
Ahsan Farooq,1 year ago,A.o.A ! Sir apny 2nd video mn it support or networking ka kha tha ..can you make a dedicated video on networking career and jobs etc please ??,,1
Chouaib Benali,1 year ago,"No offense but i have a hard time to understand this gentleman speaking,is there anyway to have a subtitle in English to follow him along ? i'm really interested about this kind of content to be fair",,1
us KHAN,1 year ago,oh i was also thinking about Germany thanks for this video sir,,2
Mr. ShadiRegistrar,1 year ago,Great Insights..,,2
Zain,1 year ago,Watching this after submitting programming assignment,,4
Muhammad Ali,1 year ago,"with great responsibility, comes great power xD Ehmad",,1
Be Fantastic,1 year ago,"Ehmad Bhai, What is the process of getting intership in Arbisoft or System limited or any other  Software house?",,2
Tuaha Tayyab,1 year ago,Informative,https://yt3.ggpht.com/ytc/AGIKgqOP5JEKnFlYNCnwHxhDmnhAU4wu7lG8yHdl-7x9Rg=s48-c-k-c0x00ffffff-no-rj,2
Ahmad Ammar,1 year ago,Timestamps pleaseee,https://yt3.ggpht.com/ytc/AGIKgqMiEwnquCu3-ZSSQQXpU7oF_OI_Fah-4N3_Ng=s48-c-k-c0x00ffffff-no-rj,1
Abdul Rehman,1 year ago,"Bro may nay front end web development sekhi hay aur InshaaAllah full stack web developer future may bano ga
Can I get a job as a full stack web developer with a degree?",https://yt3.ggpht.com/ytc/AGIKgqMsRCT_cVz0XdsSsOtsYZD1S5AWKDh---EDzJIe=s48-c-k-c0x00ffffff-no-rj,1
Zain Zain,1 year ago,Please share any social media account of Usman Abbasi ! I want to connect.,https://yt3.ggpht.com/ytc/AGIKgqO0WXUI3utrpX_HO0XXqBa3AjXLMAv_z2lTGCR_wQ=s48-c-k-c0x00ffffff-no-rj,1
Wasiullah Khan,1 year ago,Behtareen video Ehmad Bhai!,https://yt3.ggpht.com/ytc/AGIKgqMAmuUXKV-qWRADY2_S1Xfyd_gSSNgGfzQvzj2I5VI=s48-c-k-c0x00ffffff-no-rj,1
Faizan Siddiqui,1 year ago,Lahore mein software engineering ya CS ka lya konsi university aap prefer krta ho ?,https://yt3.ggpht.com/ytc/AGIKgqOTPOlghLUx_FEpAcl-6Ie7WKy-P3WwCRg21A=s48-c-k-c0x00ffffff-no-rj,1
Maryam Jamil,1 year ago,,https://yt3.ggpht.com/ytc/AGIKgqOC7M2u3AoyxGyhf-4mYzpzf258vR0FmxSjMQ=s48-c-k-c0x00ffffff-no-rj,2
AsadAliCh,1 year ago,"Ehmad Sir I want to consult with you 
I am ready to pay fees for that .",https://yt3.ggpht.com/ytc/AGIKgqO722L_bFI47P4QVQGgQQ-e0DbX-WgEl0aHtQaYO9uNaM7V0ObgZSGxvMbPI7l_=s48-c-k-c0x00ffffff-no-rj,2
Subhan Liaqat,1 year ago,My favorite  channel on YouTube,https://yt3.ggpht.com/ytc/AGIKgqOSbldCT3Vvp0adyqAaAeXTTGczlMPEODMQcaedEg=s48-c-k-c0x00ffffff-no-rj,2
Abdul Rehman,1 year ago (edited),Bro may Punjab university say affiliated college say bscs kr raha hon aur uni k first year may humay visual basic 6.0 language sikha rahain hain Jo k already he aik dead language hay,https://yt3.ggpht.com/ytc/AGIKgqMsRCT_cVz0XdsSsOtsYZD1S5AWKDh---EDzJIe=s48-c-k-c0x00ffffff-no-rj,1
Muhammad Usman,1 year ago,Please make a video with software quality engineer Manual/Automation in Germany,https://yt3.ggpht.com/ytc/AGIKgqOxUXu3Li98axpfrhFPTq6TV9A-JX5XSYP1EELu8Q=s48-c-k-c0x00ffffff-no-rj,2
JustWatchiT,9 months ago,Bro mera bachelors complete hone mn 1 year ha or mn ne masters k lye germany ana ha... pr mn aik permanent back-end languague select nhi kr pa rha jis pr mn focus krun  (.NET pr kam kia thora) java or python or php blkl basic ata ha .. mujhe Germany k lye in mn se kon c language pr kaam krna chahye jo demand mn ha taake masters krte waqt hi mn part time job krta hun as a back-end trainee,https://yt3.ggpht.com/SEi6QMQ-kHE0KIJITr9SfxIOMkgExnx8xtoxzQeBg0oOfLmBtTo44WAIs2Yz4Ddr4WrLgBOM2-A=s48-c-k-c0x00ffffff-no-rj,0
Zohaib Ashraf,9 months ago,yr make more videos those who get job in foreign countries?,,0
Zain Zia,1 year ago,Man add the timestamps plz,,6
Ranom Tech,1 year ago,29:15 Bohat Maza Aye ga Aap ko ,,0
Tobi,1 year ago,Bhai mujhy apki help chahiye computer mein maths mushkil hai ya assan hai??,,0
Moosa Butt,1 year ago,Don't forget me ehmad bhai when you have a million subs.,,1
Shahmir Raza,1 year ago,Can a CS student choose to become a backend developer/engineer?,,2
us KHAN,1 year ago,sir ak video ka request ha please batya huma ka Web development or software development or data science kon sa best field ha for best career,,1
mehran javid,1 year ago,link you've provided in the video details is not working?,,2
Salman,1 year ago (edited),4-5 mahine lagaye after job offer to get the visa? toh company ney itni dair kaya kiya? remote job?,,2
Sheheryar Malik,1 year ago,Zalendo kaisi company ha maray uncle uss company main senior software engineer hai.,https://yt3.ggpht.com/ytc/AGIKgqOySDovMGXnAo0gNN6Adjp0P_RG--JOIi4Y6MG2Lw=s48-c-k-c0x00ffffff-no-rj,1
Hadi Ali,1 year ago,usman bhi ki voice zara low thi buss....,https://yt3.ggpht.com/ytc/AGIKgqPEbLIfPngRo75eWhMTfzbfXryLmG76M-xAUihP=s48-c-k-c0x00ffffff-no-rj,1
Gaming And Tech,1 year ago,Is softwear engineering is booring or not,https://yt3.ggpht.com/ytc/AGIKgqOt0jlGi2thKOLeBiuxMHCuSvwaFe6qBpIsRaLxTg=s48-c-k-c0x00ffffff-no-rj,0
Hadi Ali,1 year ago,"awaz ki shidat ko thora mazeed bahter ker le.
baki bahtreen he.",https://yt3.ggpht.com/ytc/AGIKgqPEbLIfPngRo75eWhMTfzbfXryLmG76M-xAUihP=s48-c-k-c0x00ffffff-no-rj,1
Talha .z7,1 year ago,Camera thek Nahi yeh dono ak dosray ki taraf dakh kr bat kr ray hay bas,https://yt3.ggpht.com/ytc/AGIKgqP9teI6gIOEMqqTsP3t1P-RgOTZe9jK-b_jHkf3ZQ=s48-c-k-c0x00ffffff-no-rj,1
Ahmad Waheed,1 year ago,First view,https://yt3.ggpht.com/ytc/AGIKgqN2m8GmFg33DyF4GZKPVlSKpaf4g--YsTb-9Pd0=s48-c-k-c0x00ffffff-no-rj,2
Aizaz Haider,1 year ago,4400*,https://yt3.ggpht.com/txWp1AsLXMla_DgV3y2E6kKLuHEsqPj7ZXQhmZNoqfec_FgEePBNBgFMRz4efope_o5nWgnjyQ=s48-c-k-c0x00ffffff-no-rj,1
Veli Alizade,1 year ago,"Dude, if you make video title in english then speak in english.  There are not even subtitles. You wasting time of other people.",https://yt3.ggpht.com/ytc/AGIKgqPiyhR7vagN-6pZxVeqd_8UEbu5WUzgYlwE8w=s48-c-k-c0x00ffffff-no-rj,1
Salman Saeed,1 year ago,2nd,https://yt3.ggpht.com/ytc/AGIKgqO7XDVd-2N6nLAiN0_BFGhsRZH59BvjJBdHLgyVYys=s48-c-k-c0x00ffffff-no-rj,2
